{
  "schema_version": "incidentseal-portable-receipt/v1",
  "receipt_id": "123e4567-e89b-42d3-a456-426614174110",
  "created_at_utc": "2026-08-09T00:01:03Z",
  "authority": {
    "mode": "platform-validation",
    "workflow_id": null,
    "manifest_digest": null,
    "approval_digest": null,
    "platform_contract_digest": "sha256:57ca5f96d527da1b8ac47bf0a88f60493c730203f911db698938ebceaa9bf351"
  },
  "source": {
    "repository": "https://github.com/drwbkr1/incidentseal.git",
    "commit": "a0c05070dd1d147aecae6b4ed686440414a3aa27",
    "tree": "67c05a1090aef5f301525dbba6786c1050635629"
  },
  "bindings": [
    {
      "kind": "topology-contract",
      "name": "topology-v1",
      "digest": "sha256:57ca5f96d527da1b8ac47bf0a88f60493c730203f911db698938ebceaa9bf351"
    },
    {
      "kind": "runtime-lock",
      "name": "topology-runtime-lock",
      "digest": "sha256:8b9bbb6b7ad888a280a46ec0d591bc2470859471758fdbb33287c2ca5eeb216e"
    }
  ],
  "run": {
    "run_id": "123e4567-e89b-42d3-a456-426614174100",
    "lifecycle": "completed",
    "verdict": "PASS",
    "terminal": true,
    "terminal_event_id": "123e4567-e89b-42d3-a456-426614174103"
  },
  "event_chain": {
    "algorithm": "sha256-rfc8785-link-v1",
    "canonicalization": "RFC8785-JCS",
    "genesis_digest": "sha256:0000000000000000000000000000000000000000000000000000000000000000",
    "event_count": 3,
    "root_digest": "sha256:8aff86cd9c13469cf44a4a18e8a2ebd9d45ea3e8a73fdeeed1f0d18e66407c6c",
    "links": [
      {
        "sequence": 0,
        "event_digest": "sha256:b2b9fd32ec610c4ce102a938a2dbd830351a1b2c13ad9e254821eedbf57d8cb9",
        "previous_link_digest": "sha256:0000000000000000000000000000000000000000000000000000000000000000",
        "link_digest": "sha256:93709504b55826d6b98e59bd12d9302f50bf91b0fe745a88256ae01d8a3169d3",
        "event": {
          "schema_version": "incidentseal-evidence-event/v1",
          "event_id": "123e4567-e89b-42d3-a456-426614174101",
          "run_id": "123e4567-e89b-42d3-a456-426614174100",
          "sequence": 0,
          "occurred_at_utc": "2026-08-09T00:01:00Z",
          "event_type": "run.queued",
          "lifecycle": "queued",
          "verdict": null,
          "terminal": false,
          "authority_digest": "sha256:57ca5f96d527da1b8ac47bf0a88f60493c730203f911db698938ebceaa9bf351",
          "payload": {},
          "error": null
        }
      },
      {
        "sequence": 1,
        "event_digest": "sha256:3f280b32852b70f721dab382103b6f5a8a92b68ac96da49275541bbfc609c66d",
        "previous_link_digest": "sha256:93709504b55826d6b98e59bd12d9302f50bf91b0fe745a88256ae01d8a3169d3",
        "link_digest": "sha256:d7255e6b049eb00917fa9af11ebee962dd4b2a63057e863007cbbc185576e2c2",
        "event": {
          "schema_version": "incidentseal-evidence-event/v1",
          "event_id": "123e4567-e89b-42d3-a456-426614174102",
          "run_id": "123e4567-e89b-42d3-a456-426614174100",
          "sequence": 1,
          "occurred_at_utc": "2026-08-09T00:01:01Z",
          "event_type": "run.started",
          "lifecycle": "running",
          "verdict": null,
          "terminal": false,
          "authority_digest": "sha256:57ca5f96d527da1b8ac47bf0a88f60493c730203f911db698938ebceaa9bf351",
          "payload": {},
          "error": null
        }
      },
      {
        "sequence": 2,
        "event_digest": "sha256:ea8c01cf669ec6fed0859b4d94c91186379133d35a4f1ad394021590eb39f88a",
        "previous_link_digest": "sha256:d7255e6b049eb00917fa9af11ebee962dd4b2a63057e863007cbbc185576e2c2",
        "link_digest": "sha256:8aff86cd9c13469cf44a4a18e8a2ebd9d45ea3e8a73fdeeed1f0d18e66407c6c",
        "event": {
          "schema_version": "incidentseal-evidence-event/v1",
          "event_id": "123e4567-e89b-42d3-a456-426614174103",
          "run_id": "123e4567-e89b-42d3-a456-426614174100",
          "sequence": 2,
          "occurred_at_utc": "2026-08-09T00:01:02Z",
          "event_type": "run.completed",
          "lifecycle": "completed",
          "verdict": "PASS",
          "terminal": true,
          "authority_digest": "sha256:57ca5f96d527da1b8ac47bf0a88f60493c730203f911db698938ebceaa9bf351",
          "payload": {"passed_checks": 1},
          "error": null
        }
      }
    ]
  },
  "artifacts": [
    {
      "artifact_id": "result",
      "kind": "result",
      "path": "artifacts/result.json",
      "media_type": "application/json",
      "byte_count": 18,
      "digest": "sha256:423b0a945a73ecb5ab748c7c796af9328a4639bf6921af982e71ad00924f46e9",
      "required": true
    }
  ],
  "custody": {
    "layout": "incidentseal-portable-bundle/v1",
    "artifact_root": "artifacts",
    "path_policy": "safe-relative-posix",
    "network_required": false,
    "docker_required": false,
    "database_required": false,
    "secret_required": false
  }
}
